[
  {
    "name": "Gathering Place Community Centre",
    "address": "609 Helmcken St, Vancouver, BC V6B 5R1",
    "phone": "604-665-2391",
    "hours": "Tue & Thu 11:30am–1pm (clothing); emergency availability 9am–6pm",
    "type": "Food",
    "lat": 49.278026,
    "lng": -123.123444,
    "source": "City of Vancouver — Free and low-cost resources",
    "verified_at": "2025-11-18",
    "status": "open"
  },
  {
    "name": "Evelyne Saller Centre",
    "address": "404 Alexander St, Vancouver, BC V6A 1C5",
    "phone": "604-665-3075",
    "hours": "Mon–Fri 9am–11pm",
    "type": "Food",
    "lat": 49.281056,
    "lng": -123.105234,
    "source": "City of Vancouver — Free and low-cost resources",
    "verified_at": "2025-11-18",
    "status": "open"
  },
  {
    "name": "Lookout Housing and Health Society (site)",
    "address": "450 E Hastings St, Vancouver, BC V6A 1P7",
    "phone": "604-255-7026",
    "hours": "Daily: 1pm–5pm",
    "type": "Food",
    "lat": 49.2824,
    "lng": -123.0998,
    "source": "City of Vancouver; Lookout Housing + Health",
    "verified_at": "2025-11-18",
    "status": "open"
  },
  {
    "name": "RainCity Housing (Triage Shelter)",
    "address": "707 Powell St, Vancouver, BC V6A 1H5",
    "phone": "604-254-3700",
    "hours": "Daily: 8am–7:30pm (limited availability)",
    "type": "Shelter",
    "lat": 49.2819,
    "lng": -123.1002,
    "source": "RainCity Housing",
    "verified_at": "2025-11-18",
    "status": "open"
  },
  {
    "name": "Union Gospel Mission — The Cornerstone",
    "address": "601 E Hastings St, Vancouver, BC V6A 1J7",
    "phone": "604-253-3323",
    "hours": "Meals (varies)",
    "type": "Food",
    "lat": 49.2827,
    "lng": -123.1010,
    "source": "Union Gospel Mission",
    "verified_at": "2025-11-18",
    "status": "open"
  },
  {
    "name": "DTES Neighbourhood House",
    "address": "573 E Hastings St, Vancouver, BC",
    "phone": "604-215-2030",
    "hours": "Mon–Fri 9am–5pm",
    "type": "Food",
    "lat": 49.2825,
    "lng": -123.1015,
    "source": "City of Vancouver",
    "verified_at": "2025-11-18",
    "status": "open"
  },
  {
    "name": "Ray-Cam Co-operative Centre",
    "address": "920 E Hastings St, Vancouver, BC",
    "phone": "604-257-6944",
    "hours": "Mon–Fri 9am–9pm",
    "type": "Food",
    "lat": 49.2842,
    "lng": -123.0969,
    "source": "City of Vancouver",
    "verified_at": "2025-11-18",
    "status": "open"
  },
  {
    "name": "Covenant House Vancouver",
    "address": "575 Drake St, Vancouver, BC",
    "phone": "604-638-4438",
    "hours": "Youth drop-in (see Covenant House)",
    "type": "Shelter",
    "lat": 49.2820,
    "lng": -123.1034,
    "source": "Covenant House",
    "verified_at": "2025-11-18",
    "status": "open"
  },
  {
    "name": "Atira Women's Resource Society",
    "address": "101 E Cordova St, Vancouver, BC",
    "phone": "604-331-1407",
    "hours": "Mon–Fri 10:30am–1:30pm",
    "type": "Clothing",
    "lat": 49.2834,
    "lng": -123.0976,
    "source": "Atira",
    "verified_at": "2025-11-18",
    "status": "open"
  },
  {
    "name": "Insite Supervised Consumption Site",
    "address": "139 E Hastings St, Vancouver, BC",
    "phone": "604-685-7677",
    "hours": "24/7",
    "type": "Injection Site",
    "lat": 49.2811,
    "lng": -123.0995,
    "description": "Supervised consumption and harm reduction services",
    "source": "VCH / Insite",
    "verified_at": "2025-11-18",
    "status": "open"
  },
  {
    "name": "Portland Hotel Society",
    "address": "403 E Hastings St, Vancouver, BC V6A 1N6",
    "phone": "604-681-8976",
    "hours": "24/7",
    "type": "Shelter",
    "lat": 49.2822,
    "lng": -123.0998,
    "source": "Portland Hotel Society",
    "verified_at": "2025-11-18",
    "status": "open"
  },
  {
    "name": "First United Church",
    "address": "320 E Hastings St, Vancouver, BC V6A 1N8",
    "phone": "604-681-8365",
    "hours": "Mon–Fri 9am–5pm",
    "type": "Food",
    "lat": 49.2830,
    "lng": -123.0990,
    "source": "First United Church",
    "verified_at": "2025-11-18",
    "status": "open"
  },
  {
    "name": "St. Paul's Hospital Emergency",
    "address": "1081 Burrard St, Vancouver, BC V6Z 1Y6",
    "phone": "604-682-2344",
    "hours": "24/7",
    "type": "Mental Health",
    "lat": 49.2845,
    "lng": -123.1230,
    "source": "St. Paul's Hospital",
    "verified_at": "2025-11-18",
    "status": "open"
  },
  {
    "name": "Vancouver Coastal Health Downtown Community Health Centre",
    "address": "569 Seymour St, Vancouver, BC V6B 3H6",
    "phone": "604-675-2520",
    "hours": "Mon–Fri 8:30am–4:30pm",
    "type": "Mental Health",
    "lat": 49.2835,
    "lng": -123.1220,
    "source": "Vancouver Coastal Health",
    "verified_at": "2025-11-18",
    "status": "open"
  },
  {
    "name": "BC Centre for Disease Control",
    "address": "655 W 12th Ave, Vancouver, BC V5Z 4R4",
    "phone": "604-707-2400",
    "hours": "Mon–Fri 8:30am–4:30pm",
    "type": "Naloxone",
    "lat": 49.2630,
    "lng": -123.1260,
    "source": "BCCDC",
    "verified_at": "2025-11-18",
    "status": "open"
  },
  {
    "name": "Powell Street Getaway",
    "address": "276 Powell St, Vancouver, BC V6A 1E9",
    "phone": "604-255-8640",
    "hours": "Mon–Fri 9am–5pm",
    "type": "Washrooms",
    "lat": 49.2840,
    "lng": -123.0995,
    "source": "Powell Street Getaway",
    "verified_at": "2025-11-18",
    "status": "open"
  },
  {
    "name": "Vancouver Native Health Society",
    "address": "449 E Hastings St, Vancouver, BC V6A 1P6",
    "phone": "604-254-9930",
    "hours": "Mon–Fri 9am–5pm",
    "type": "Mental Health",
    "lat": 49.2820,
    "lng": -123.0990,
    "source": "Vancouver Native Health Society",
    "verified_at": "2025-11-18",
    "status": "open"
  },
  {
    "name": "Carnegie Community Centre",
    "address": "401 Main St, Vancouver, BC V6A 2S7",
    "phone": "604-665-2220",
    "hours": "Mon–Fri 9am–9pm, Sat–Sun 10am–5pm",
    "type": "Food",
    "lat": 49.2835,
    "lng": -123.1005,
    "source": "Carnegie Community Centre",
    "verified_at": "2025-11-18",
    "status": "open"
  },
  {
    "name": "Overdose Prevention Site (OPS)",
    "address": "390 Main St, Vancouver, BC V6A 2S7",
    "phone": "604-685-7677",
    "hours": "24/7",
    "type": "Injection Site",
    "lat": 49.2830,
    "lng": -123.1000,
    "description": "Overdose prevention services",
    "source": "VCH",
    "verified_at": "2025-11-18",
    "status": "open"
  },
  {
    "name": "BC Crisis Line",
    "address": "Province-wide service",
    "phone": "310-6789",
    "hours": "24/7",
    "type": "Hotline",
    "lat": null,
    "lng": null,
    "description": "Mental health and substance use support",
    "source": "BC Crisis Centre",
    "verified_at": "2025-11-18",
    "status": "open"
  },
  {
    "name": "1-800 SUICIDE",
    "address": "Province-wide service",
    "phone": "1-800-784-2433",
    "hours": "24/7",
    "type": "Hotline",
    "lat": null,
    "lng": null,
    "description": "Suicide prevention and emotional support",
    "source": "BC Crisis Centre",
    "verified_at": "2025-11-18",
    "status": "open"
  },
  {
    "name": "Kids Help Phone",
    "address": "Canada-wide service",
    "phone": "1-800-668-6868",
    "hours": "24/7",
    "type": "Hotline",
    "lat": null,
    "lng": null,
    "description": "Support for children and youth",
    "source": "Kids Help Phone",
    "verified_at": "2025-11-18",
    "status": "open"
  },
  {
    "name": "VictimLinkBC",
    "address": "Province-wide service",
    "phone": "1-800-563-0808",
    "hours": "24/7",
    "type": "Hotline",
    "lat": null,
    "lng": null,
    "description": "Support for victims of crime and family violence",
    "source": "VictimLinkBC",
    "verified_at": "2025-11-18",
    "status": "open"
  },
  {
    "name": "8-1-1 HealthLinkBC",
    "address": "Province-wide service",
    "phone": "8-1-1",
    "hours": "24/7",
    "type": "Hotline",
    "lat": null,
    "lng": null,
    "description": "Health information and advice",
    "source": "HealthLinkBC",
    "verified_at": "2025-11-18",
    "status": "open"
  }
]
